{
  "policy_id": "spectrum-policy-example-v1",
  "region": "REGULATORY-DOMAIN-CODE",
  "created_at": "2026-08-01T00:00:00+00:00",
  "expires_at": "2026-09-01T00:00:00+00:00",
  "passive_only": true,
  "max_scans_per_hour": 240,
  "min_scan_interval_seconds": 1.0,
  "bands": [
    {
      "band_id": "wifi-2g4",
      "label": "ISM 2.4 GHz",
      "freq_low_hz": 2400000000,
      "freq_high_hz": 2483500000,
      "max_resolution_bandwidth_hz": 1000000,
      "occupancy_baseline_percent": 20.0,
      "occupancy_alert_percent": 75.0,
      "noise_floor_baseline_dbm": -95.0,
      "comms_candidate": true
    },
    {
      "band_id": "wifi-5g",
      "label": "U-NII 5 GHz",
      "freq_low_hz": 5150000000,
      "freq_high_hz": 5895000000,
      "max_resolution_bandwidth_hz": 2000000,
      "occupancy_baseline_percent": 10.0,
      "occupancy_alert_percent": 70.0,
      "noise_floor_baseline_dbm": -98.0,
      "comms_candidate": true
    },
    {
      "band_id": "ism-433",
      "label": "ISM 433 MHz (sensing only)",
      "freq_low_hz": 433050000,
      "freq_high_hz": 434790000,
      "max_resolution_bandwidth_hz": 50000,
      "occupancy_baseline_percent": 5.0,
      "occupancy_alert_percent": 60.0,
      "noise_floor_baseline_dbm": -110.0,
      "comms_candidate": false
    }
  ]
}
